<?xml version="1.0" encoding="UTF-8"?>
<?xml-stylesheet type="text/xsl" href="http://lsst-sal.tuc.noao.edu/schema/SALEventSet.xsl"?>
<SALEventSet xmlns:xsi="http://www.w3.org/2001/XMLSchema-instance"
	xsi:noNamespaceSchemaLocation="http://lsst-sal.tuc.noao.edu/schema/SALEventSet.xsd">

<SALEvent>
 <Subsystem>MTMount</Subsystem>
<<<<<<< HEAD
 <Version>2.5.3</Version>
 <Author>salgenerator</Author>
 <EFDB_Topic>MTMount_logevent_accLimit</EFDB_Topic>
 <Alias>accLimit</Alias>
 <Explanation>http://sal.lsst.org/SAL/Events/MTMount_logevent_accLimit.html</Explanation>
</SALEvent>

<SALEvent>
 <Subsystem>MTMount</Subsystem>
 <Version>2.5.3</Version>
 <Author>salgenerator</Author>
 <EFDB_Topic>MTMount_logevent_altLimit</EFDB_Topic>
 <Alias>altLimit</Alias>
 <Explanation>http://sal.lsst.org/SAL/Events/MTMount_logevent_altLimit.html</Explanation>
    <item>
      <EFDB_Name>priority</EFDB_Name>
      <Description>Severity of the event</Description>
      <IDL_Type>long</IDL_Type>
      <Units>NA</Units>
      <Count>1</Count>
    </item>
    <item>
      <EFDB_Name>type</EFDB_Name>
      <Description> </Description>
       <IDL_Type>string</IDL_Type>
      <Units> </Units>
=======
 <Version>3.0</Version>
 <Author>Ander Ansuategi</Author>
 <EFDB_Topic>MTMount_logevent_mountState</EFDB_Topic>
 <Alias>mountState</Alias>
 <Explanation>http://sal.lsst.org/SAL/Events/MTMount_mountState.html</Explanation>
    <item>
      <EFDB_Name>id</EFDB_Name>
      <Description>Identifier of the state</Description>
      <IDL_Type>long</IDL_Type>
      <Units></Units>
      <Count>1</Count>
    </item>
    <item>
      <EFDB_Name>text</EFDB_Name>
      <Description>The state of the state machine</Description>
       <IDL_Type>string</IDL_Type>
      <Units></Units>
>>>>>>> release/Release-3-RC1
      <Count>1</Count>
    </item>
</SALEvent>

<SALEvent>
 <Subsystem>MTMount</Subsystem>
<<<<<<< HEAD
 <Version>2.5.3</Version>
 <Author>salgenerator</Author>
 <EFDB_Topic>MTMount_logevent_interlock</EFDB_Topic>
 <Alias>interlock</Alias>
 <Explanation>http://sal.lsst.org/SAL/Events/MTMount_logevent_interlock.html</Explanation>
    <item>
      <EFDB_Name>priority</EFDB_Name>
      <Description>Severity of the event</Description>
      <IDL_Type>long</IDL_Type>
      <Units>NA</Units>
      <Count>1</Count>
    </item>
    <item>
      <EFDB_Name>detail</EFDB_Name>
      <Description> </Description>
       <IDL_Type>string</IDL_Type>
      <Units> </Units>
=======
 <Version>3.0</Version>
 <Author>Ander Ansuategi</Author>
 <EFDB_Topic>MTMount_logevent_mountWarning</EFDB_Topic>
 <Alias>mountWarning</Alias>
 <Explanation>http://sal.lsst.org/SAL/Events/MTMount_mountWarning.html</Explanation>
    <item>
      <EFDB_Name>id</EFDB_Name>
      <Description>Identifier of the warning</Description>
      <IDL_Type>long</IDL_Type>
      <Units></Units>
      <Count>1</Count>
    </item>
    <item>
      <EFDB_Name>text</EFDB_Name>
      <Description>The warning info</Description>
       <IDL_Type>string</IDL_Type>
      <Units></Units>
>>>>>>> release/Release-3-RC1
      <Count>1</Count>
    </item>
</SALEvent>

<SALEvent>
 <Subsystem>MTMount</Subsystem>
<<<<<<< HEAD
 <Version>2.5.3</Version>
 <Author>salgenerator</Author>
 <EFDB_Topic>MTMount_logevent_powerError</EFDB_Topic>
 <Alias>powerError</Alias>
 <Explanation>http://sal.lsst.org/SAL/Events/MTMount_logevent_powerError.html</Explanation>
    <item>
      <EFDB_Name>priority</EFDB_Name>
      <Description>Severity of the event</Description>
      <IDL_Type>long</IDL_Type>
      <Units>NA</Units>
      <Count>1</Count>
    </item>
    <item>
      <EFDB_Name>device</EFDB_Name>
      <Description> </Description>
       <IDL_Type>string</IDL_Type>
      <Units> </Units>
      <Count>1</Count>
    </item>
    <item>
      <EFDB_Name>severity</EFDB_Name>
      <Description> </Description>
       <IDL_Type>long</IDL_Type>
      <Units> </Units>
=======
 <Version>3.0</Version>
 <Author>Ander Ansuategi</Author>
 <EFDB_Topic>MTMount_logevent_mountError</EFDB_Topic>
 <Alias>mountError</Alias>
 <Explanation>http://sal.lsst.org/SAL/Events/MTMount_mountError.html</Explanation>
    <item>
      <EFDB_Name>id</EFDB_Name>
      <Description>Identifier of the error</Description>
      <IDL_Type>long</IDL_Type>
      <Units></Units>
      <Count>1</Count>
    </item>
    <item>
      <EFDB_Name>text</EFDB_Name>
      <Description>The error info</Description>
       <IDL_Type>string</IDL_Type>
      <Units></Units>
>>>>>>> release/Release-3-RC1
      <Count>1</Count>
    </item>
</SALEvent>

<SALEvent>
 <Subsystem>MTMount</Subsystem>
<<<<<<< HEAD
 <Version>2.5.3</Version>
 <Author>salgenerator</Author>
 <EFDB_Topic>MTMount_logevent_slewError</EFDB_Topic>
 <Alias>slewError</Alias>
 <Explanation>http://sal.lsst.org/SAL/Events/MTMount_logevent_slewError.html</Explanation>
</SALEvent>

<SALEvent>
 <Subsystem>MTMount</Subsystem>
 <Version>2.5.3</Version>
 <Author>salgenerator</Author>
 <EFDB_Topic>MTMount_logevent_slewOK</EFDB_Topic>
 <Alias>slewOK</Alias>
 <Explanation>http://sal.lsst.org/SAL/Events/MTMount_logevent_slewOK.html</Explanation>
</SALEvent>

<SALEvent>
 <Subsystem>MTMount</Subsystem>
 <Version>2.5.3</Version>
 <Author>salgenerator</Author>
 <EFDB_Topic>MTMount_logevent_slewReady</EFDB_Topic>
 <Alias>slewReady</Alias>
 <Explanation>http://sal.lsst.org/SAL/Events/MTMount_logevent_slewReady.html</Explanation>
</SALEvent>

<SALEvent>
 <Subsystem>MTMount</Subsystem>
 <Version>2.5.3</Version>
 <Author>salgenerator</Author>
 <EFDB_Topic>MTMount_logevent_tempError</EFDB_Topic>
 <Alias>tempError</Alias>
 <Explanation>http://sal.lsst.org/SAL/Events/MTMount_logevent_tempError.html</Explanation>
    <item>
      <EFDB_Name>priority</EFDB_Name>
      <Description>Severity of the event</Description>
      <IDL_Type>long</IDL_Type>
      <Units>NA</Units>
      <Count>1</Count>
    </item>
    <item>
      <EFDB_Name>device</EFDB_Name>
      <Description> </Description>
       <IDL_Type>string</IDL_Type>
      <Units> </Units>
      <Count>1</Count>
    </item>
    <item>
      <EFDB_Name>severity</EFDB_Name>
      <Description> </Description>
       <IDL_Type>long</IDL_Type>
      <Units> </Units>
      <Count>1</Count>
    </item>
</SALEvent>

<SALEvent>
 <Subsystem>MTMount</Subsystem>
 <Version>2.5.3</Version>
 <Author>salgenerator</Author>
 <EFDB_Topic>MTMount_logevent_trackLost</EFDB_Topic>
 <Alias>trackLost</Alias>
 <Explanation>http://sal.lsst.org/SAL/Events/MTMount_logevent_trackLost.html</Explanation>
</SALEvent>

<SALEvent>
 <Subsystem>MTMount</Subsystem>
 <Version>2.5.3</Version>
 <Author>salgenerator</Author>
 <EFDB_Topic>MTMount_logevent_tracking</EFDB_Topic>
 <Alias>tracking</Alias>
 <Explanation>http://sal.lsst.org/SAL/Events/MTMount_logevent_tracking.html</Explanation>
</SALEvent>

<SALEvent>
 <Subsystem>MTMount</Subsystem>
 <Version>2.5.3</Version>
 <Author>salgenerator</Author>
 <EFDB_Topic>MTMount_logevent_velLimit</EFDB_Topic>
 <Alias>velLimit</Alias>
 <Explanation>http://sal.lsst.org/SAL/Events/MTMount_logevent_velLimit.html</Explanation>
=======
 <Version>3.0</Version>
 <Author>Ander Ansuategi</Author>
 <EFDB_Topic>MTMount_logevent_mountInPosition</EFDB_Topic>
 <Alias>mountInPosition</Alias>
 <Explanation>http://sal.lsst.org/SAL/Events/MTMount_mountInPosition.html</Explanation>
    <item>
      <EFDB_Name>inposition</EFDB_Name>
      <Description>Whether the mount is in position or not</Description>
      <IDL_Type>boolean</IDL_Type>
      <Units></Units>
      <Count>1</Count>
    </item>
>>>>>>> release/Release-3-RC1
</SALEvent>
</SALEventSet>
