<?xml version="1.0" encoding="UTF-8"?>
<?xml-stylesheet type="text/xsl" href="SALEventSet.xsl"?>
<SALEventSet xmlns:xsi="http://www.w3.org/2001/XMLSchema-instance"
	xsi:noNamespaceSchemaLocation="SALEventSet.xsd">

<SALEvent>
 <Subsystem>tcs</Subsystem>
 <Version>2.4</Version>
 <Author>salgenerator</Author>
 <EFDB_Topic>tcs_logevent_wfsdataReady</EFDB_Topic>
 <Alias>wfsdataReady</Alias>
 <Explanation>http://sal.lsst.org/SAL/Events/tcs_logevent_wfsdataReady.html</Explanation>
    <item>
      <EFDB_Name>priority</EFDB_Name>
      <Description>Severity of the event</Description>
      <IDL_Type>long</IDL_Type>
      <Units>NA</Units>
      <Count>1</Count>
    </item>
    <item>
      <EFDB_Name>images_location_URI</EFDB_Name>
      <Description> </Description>
      <IDL_Type>string<256></IDL_Type>
      <Units> </Units>
      <Count>1</Count>
    </item>
    <item>
      <EFDB_Name>images_match_URI</EFDB_Name>
      <Description> </Description>
      <IDL_Type>string<64></IDL_Type>
      <Units> </Units>
      <Count>1</Count>
    </item>
</SALEvent>

<SALEvent>
 <Subsystem>tcs</Subsystem>
 <Version>2.4</Version>
 <Author>salgenerator</Author>
 <EFDB_Topic>tcs_logevent_zemaxError</EFDB_Topic>
 <Alias>zemaxError</Alias>
 <Explanation>http://sal.lsst.org/SAL/Events/tcs_logevent_zemaxError.html</Explanation>
    <item>
      <EFDB_Name>priority</EFDB_Name>
      <Description>Severity of the event</Description>
      <IDL_Type>long</IDL_Type>
      <Units>NA</Units>
      <Count>1</Count>
    </item>
    <item>
      <EFDB_Name>details</EFDB_Name>
      <Description> </Description>
      <IDL_Type>string<128></IDL_Type>
      <Units> </Units>
      <Count>1</Count>
    </item>
</SALEvent>
</SALEventSet>
